{
  "$schema": "https://json-schema.org/draft/2020-12/schema",
  "$id": "schema://frank.screen/v1",
  "title": "FRANK screen and route contract",
  "description": "FRANK-§3.8. A machine-readable contract for every user-facing screen. A route absent from the registry cannot ship. Duplicate paths, undeclared commands, missing authorization, missing state coverage, inaccessible primary actions, and pack route collisions fail CI. URLs contain only opaque identifiers, never secrets or sensitive labels.",
  "type": "object",
  "additionalProperties": false,
  "required": [
    "schema",
    "id",
    "path",
    "navigation",
    "roles",
    "compartments",
    "objects",
    "query_schema",
    "commands",
    "event_parts",
    "states",
    "offline",
    "capabilities",
    "deep_links",
    "acceptance_journeys"
  ],
  "properties": {
    "schema": { "const": "frank.screen/v1" },
    "id": {
      "description": "Unique screen identifier in dot-separated form.",
      "type": "string",
      "pattern": "^[a-z0-9]+([._-][a-z0-9]+)*$"
    },
    "path": {
      "description": "FRANK-§3.8. URL path for this screen. Must contain only opaque identifiers, never secrets or sensitive labels. Use route parameters like :id for opaque resource identifiers only.",
      "type": "string",
      "minLength": 1
    },
    "navigation": {
      "description": "Navigation placement: primary (top-level), contextual (within object), or detail (specific record view).",
      "type": "string",
      "enum": ["primary", "contextual", "detail"]
    },
    "roles": {
      "description": "FRANK-§3.8 and §2.2. Array of authorized roles. Missing authorization fails CI.",
      "type": "array",
      "items": {
        "type": "string",
        "enum": ["owner", "operator", "builder", "member", "reviewer", "service"]
      },
      "minItems": 1
    },
    "compartments": {
      "description": "Array of data compartment identifiers this screen respects (project, room, cell scope, etc). Empty array means no compartment filtering.",
      "type": "array",
      "items": {
        "type": "string",
        "minLength": 1
      }
    },
    "objects": {
      "description": "FRANK-§3.8. Array of primary object types shown on this screen. Missing state coverage for an object fails CI.",
      "type": "array",
      "items": {
        "type": "string",
        "minLength": 1
      },
      "minItems": 1
    },
    "query_schema": {
      "description": "Schema identifier for the query parameters accepted by this screen.",
      "type": "string",
      "minLength": 1
    },
    "commands": {
      "description": "FRANK-§3.8. Array of command identifiers that may be invoked from this screen. Undeclared commands fail CI.",
      "type": "array",
      "items": {
        "type": "string",
        "minLength": 1
      }
    },
    "event_parts": {
      "description": "Array of event type patterns that trigger live updates on this screen.",
      "type": "array",
      "items": {
        "type": "string",
        "minLength": 1
      }
    },
    "states": {
      "description": "FRANK-§3.7 and §3.8. Array of UI states this screen must implement: loading, empty, partial, stale, offline, denied, degraded, error, recovery, success. Missing state coverage fails CI.",
      "type": "array",
      "items": {
        "type": "string",
        "enum": ["loading", "empty", "partial", "stale", "offline", "denied", "degraded", "error", "recovery", "success"]
      },
      "minItems": 1
    },
    "offline": {
      "description": "FRANK-§3.7. Offline handling strategy: read-cached (serve stale data), sync-on-connect (queue updates), or none (disable offline).",
      "type": "string",
      "enum": ["read-cached", "sync-on-connect", "none"]
    },
    "capabilities": {
      "description": "FRANK-§3.7. Array of platform capabilities required: camera, microphone, geolocation, filesystem, native-bridge, push, share-target.",
      "type": "array",
      "items": {
        "type": "string",
        "enum": ["camera", "microphone", "geolocation", "filesystem", "native-bridge", "push", "share-target"]
      }
    },
    "deep_links": {
      "description": "Array of platforms supporting deep links to this screen: web, pwa, tauri.",
      "type": "array",
      "items": {
        "type": "string",
        "enum": ["web", "pwa", "tauri"]
      },
      "minItems": 1
    },
    "acceptance_journeys": {
      "description": "FRANK-§3.7. Array of versioned acceptance test journeys that exercise this screen.",
      "type": "array",
      "items": {
        "type": "string",
        "minLength": 1
      }
    }
  }
}
